{
  "schema_version": 1,
  "layer": "aoa-playbooks",
  "source_of_truth": {
    "reviewed_runs_dir": "docs/real-runs",
    "gate_reviews_dir": "docs/gate-reviews"
  },
  "playbooks": [
    {
      "playbook_id": "AOA-P-0017",
      "playbook_name": "split-wave-cross-repo-rollout",
      "scenario": "split_wave_cross_repo_rollout",
      "gate_review_ref": "docs/gate-reviews/split-wave-cross-repo-rollout.md",
      "reviewed_run_count": 3,
      "reviewed_run_refs": [
        "docs/real-runs/2026-03-21.split-wave-cross-repo-rollout.md",
        "docs/real-runs/2026-03-28.split-wave-cross-repo-rollout.md",
        "docs/real-runs/2026-04-07.split-wave-cross-repo-rollout.md"
      ],
      "latest_reviewed_run_ref": "docs/real-runs/2026-04-07.split-wave-cross-repo-rollout.md",
      "minimum_evidence_threshold": "One real ordered-wave run with `wave_plan`, `bridge_surface_pack`, `downstream_revalidation_pack`, and `handoff_record`",
      "gate_verdict": "composition-landed",
      "next_trigger": "- Review later evidence only if a distinct adjunct family appears or a later run falsifies the current bridge boundary; otherwise keep the minimal composition-owned split-wave handoff bridge as the stable AOA-P-0017 landing.",
      "composition_signal_summary": {
        "failure_or_follow_up": "Stable failure or follow-up mapping not already covered by AOA-P-0010 or the shared failure catalog: established across three reviewed runs. Source-owned bridge publication plus downstream revalidation now appears as a stable split-wave need across both routing-adjacent and surface-detection consumer families.",
        "adjunct_candidate": "Stable adjunct candidate in the form of a handoff bridge, subagent split, or automation seed: still established as a handoff bridge. The March 21 reciprocal merge-note pattern, the March 28 docs/CROSS_REPO_ROUTER_BRIDGE.md surface, and the April 7 sibling-surface closure route now support the already-landed composition bridge rather than leaving it routing-only."
      }
    },
    {
      "playbook_id": "AOA-P-0018",
      "playbook_name": "validation-driven-remediation",
      "scenario": "validation_driven_remediation",
      "gate_review_ref": "docs/gate-reviews/validation-driven-remediation.md",
      "reviewed_run_count": 1,
      "reviewed_run_refs": [
        "docs/real-runs/2026-04-05.validation-driven-remediation.md"
      ],
      "latest_reviewed_run_ref": "docs/real-runs/2026-04-05.validation-driven-remediation.md",
      "minimum_evidence_threshold": "One real remediation run with `failure_map`, `boundary_map`, `remediation_change_set`, `revalidation_pack`, `remediation_decision`, and `handoff_record`",
      "gate_verdict": "hold",
      "next_trigger": "- Re-open this gate after the April 6, 2026 second different-family remediation run gains reviewable Evidence Links and lands as a committed reviewed summary, or after a distinct remediation-owned adjunct candidate becomes stable enough for bounded composition review.",
      "composition_signal_summary": {
        "failure_or_follow_up": "Stable failure or follow-up mapping not already covered by neighboring rollout, cutover, or incident playbooks or the shared failure catalog: not yet established for composition. The April 5 run proves the general playbook boundary, but one harvested remediation run is still too weak to show a distinct playbook-owned mapping beyond current doctrine.",
        "adjunct_candidate": "Stable adjunct candidate in the form of a handoff bridge, subagent split, or automation seed: not yet established. The run hints at future multi-repo revalidation or handoff closure adjuncts, but none are stable enough yet for composition review."
      }
    },
    {
      "playbook_id": "AOA-P-0019",
      "playbook_name": "release-migration-cutover",
      "scenario": "release_migration_cutover",
      "gate_review_ref": "docs/gate-reviews/release-migration-cutover.md",
      "reviewed_run_count": 0,
      "reviewed_run_refs": [],
      "latest_reviewed_run_ref": null,
      "minimum_evidence_threshold": "One real cutover run with `cutover_plan`, `cutover_decision`, `post_cutover_verification_pack`, and `handoff_record`",
      "gate_verdict": "hold",
      "next_trigger": "- Re-open this gate only after a qualifying adjacent-ecosystem cutover run closes with the required anchor artifacts and reviewable evidence links, while still proving an AoA authority switch rather than a runtime-only or overlay-only promotion.",
      "composition_signal_summary": {
        "failure_or_follow_up": "Stable failure or follow-up mapping not already covered by neighboring cutover or rollout playbooks or the shared failure catalog: cannot be evaluated until a qualifying reviewed summary exists",
        "adjunct_candidate": "Stable adjunct candidate in the form of a handoff bridge, subagent split, or automation seed: cannot be evaluated until a qualifying reviewed summary exists"
      }
    },
    {
      "playbook_id": "AOA-P-0020",
      "playbook_name": "incident-recovery-routing",
      "scenario": "incident_recovery_routing",
      "gate_review_ref": "docs/gate-reviews/incident-recovery-routing.md",
      "reviewed_run_count": 0,
      "reviewed_run_refs": [],
      "latest_reviewed_run_ref": null,
      "minimum_evidence_threshold": "One real incident recovery run with `incident_map`, `stabilization_plan`, `recovery_decision`, `recovery_verification_pack`, and `handoff_record`",
      "gate_verdict": "hold",
      "next_trigger": "- Re-open this gate only after a live incident closes with the required anchor artifacts, reviewable evidence links, and a reviewed summary.",
      "composition_signal_summary": {
        "failure_or_follow_up": "Stable failure or follow-up mapping not already covered by neighboring recovery or remediation playbooks or the shared failure catalog: cannot be evaluated until a live incident reviewed summary exists",
        "adjunct_candidate": "Stable adjunct candidate in the form of a handoff bridge, subagent split, or automation seed: cannot be evaluated until a live incident reviewed summary exists"
      }
    },
    {
      "playbook_id": "AOA-P-0021",
      "playbook_name": "owner-first-capability-landing",
      "scenario": "owner_first_capability_landing",
      "gate_review_ref": "docs/gate-reviews/owner-first-capability-landing.md",
      "reviewed_run_count": 3,
      "reviewed_run_refs": [
        "docs/real-runs/2026-04-07.owner-first-capability-landing.md",
        "docs/real-runs/2026-04-08.owner-first-capability-landing.md",
        "docs/real-runs/2026-04-08.owner-first-capability-landing.tos-graph-curation.md"
      ],
      "latest_reviewed_run_ref": "docs/real-runs/2026-04-08.owner-first-capability-landing.tos-graph-curation.md",
      "minimum_evidence_threshold": "One real owner-first capability landing route with `candidate_lineage_pack`, `owner_landing_bundle`, `landing_decision`, `rollout_pack`, `validation_pack`, `hardening_record`, and `handoff_record`",
      "gate_verdict": "composition-landed",
      "next_trigger": "- Re-open this gate only if a later run falsifies the owner-first boundary or a distinct adjunct family appears. Otherwise keep the current bounded owner-first landing bridge as the stable AOA-P-0021 composition landing across both remediation-heavy and inspect-first staged-lineage families.",
      "composition_signal_summary": {
        "failure_or_follow_up": "Stable failure or follow-up mapping not already covered by neighboring rollout, remediation, cutover, incident, or closeout-continuity playbooks or the shared doctrine: established across three reviewed runs. The April 7 remediation closure, the April 8 via-negativa wave, and the later April 8 tos-graph curation route all prove the same stable path from reviewed staged lineage into merged owner truth and post-merge Dionysus sync across capability, doctrine, and bounded runtime-hardening families.",
        "adjunct_candidate": "Stable adjunct candidate in the form of a handoff bridge, subagent split, or automation seed: still established as a handoff bridge. The third reviewed run further strengthens the bounded bridge between staged lineage in Dionysus and merged owner truth across local, GitHub-only, doctrine/checklist, and bounded runtime owner surfaces without turning that bridge into automation authority."
      }
    },
    {
      "playbook_id": "AOA-P-0023",
      "playbook_name": "closeout-owner-follow-through-continuity",
      "scenario": "closeout_owner_follow_through_continuity",
      "gate_review_ref": "docs/gate-reviews/closeout-owner-follow-through-continuity.md",
      "reviewed_run_count": 9,
      "reviewed_run_refs": [
        "docs/real-runs/2026-04-08.closeout-owner-follow-through-continuity.md",
        "docs/real-runs/2026-04-09.closeout-owner-follow-through-continuity.workspace-checkpoint-growth.md",
        "docs/real-runs/2026-04-13.closeout-owner-follow-through-continuity.aoa-kag-owner-followthrough.md",
        "docs/real-runs/2026-04-19.closeout-owner-follow-through-continuity.live-codex-finding-repair.md",
        "docs/real-runs/2026-04-20.closeout-owner-follow-through-continuity.release-wave-closeout.md",
        "docs/real-runs/2026-04-20.closeout-owner-follow-through-continuity.aoa-evals-proof-gates.md",
        "docs/real-runs/2026-04-22.closeout-owner-follow-through-continuity.wave5-repair-post-closeout.md",
        "docs/real-runs/2026-04-23.closeout-owner-follow-through-continuity.experience-v1-2-v2-0.md",
        "docs/real-runs/2026-05-01.closeout-owner-follow-through-continuity.agents-of-abyss-v0-4-0.md"
      ],
      "latest_reviewed_run_ref": "docs/real-runs/2026-05-01.closeout-owner-follow-through-continuity.agents-of-abyss-v0-4-0.md",